{
  "agent_id": "tech_lead",
  "timestamp": "2026-05-12T15:30:00Z",
  "intent_resolution": "approved",
  "human_readable_summary": "已核准初步的 Runtime 目錄結構設計。此設計符合 MVP 需求，且不依賴外部複雜框架，保證了 Governance-first 原則的落實。",
  "structured_payload": {
    "next_action": "delegate",
    "target_agent": "execution_agent",
    "tasks": ["create_directories"]
  },
  "governance_check": {
    "rollback_plan": "如果發現檔案覆蓋或結構衝突，請利用 git reset --hard 回滾至前一 commit 狀態。",
    "audit_trail": "遵循了「不使用 database、純 Python standard library」的架構約束。"
  }
}
