{
  "agent_id": "tech_lead",
  "timestamp": "2026-05-12T16:00:00Z",
  "intent_resolution": "approved",
  "human_readable_summary": "已審核並批准此項架構變更。",
  "structured_payload": {
    "action": "delegate_task",
    "target": "execution_agent"
  },
  "governance_check": {
    "rollback_plan": "回滾至前一版架構設定。",
    "audit_trail": "符合無資料庫架構原則。"
  }
}
